Category,Price,ImageUrl,Address,Description,Detail Url
Bureaux seulement,1 749 $,https://mspublic.centris.ca/media.ashx?id=ADDD250DCA3DD82DDDDDDDDDD2&t=pi&w=320&h=240&sm=c,"1405A, boulevard Henri-Bourassa Ouest, local 012, Montréal (Ahuntsic-Cartierville), Quartier Nouveau Bordeaux","Bureau ouvert de 1399 pieds carrés à louer avec beaucoup de lumière dans un immeuble à bureau situé sur le boul. Henri-Bourassa à Ahuntsic, Montréal. Situé à 1 minutes de l'autoroute 15. Prix: 1749$/mois tout inclus! (Frais d'opération, taxes scolaire et municipales, électricité, air climatisé et chauffage) Il est possible de diviser le local au besoin.",https://www.centris.ca/fr/local-commercial~a-louer~montreal-ahuntsic-cartierville/24719103?view=Summary
Commerciale et bureaux,15 $,https://mspublic.centris.ca/media.ashx?id=ADDD250DCA8EFC3DDDDDDDDDDB&t=pi&w=320&h=240&sm=c,"2120, Rue Sherbrooke Est, local 1118, Montréal (Ville-Marie), Quartier Centre","Espace de bureau de première qualité situé au dernier étage dans un emplacement de choix au coin de Sherbrooke et De Lorimier. Cette unité comprend 3,749 pieds carrés avec une cuisine existante, des panneaux de séparation accoustique en verre et 6 places de stationnement intérieur. L'immeuble offre une sécurité 24/7, un service de nettoyage, un restaurant au rez-de-chaussée et un service de conciergerie. Cette offre est une sous-location avec des conditions flexibles.",https://www.centris.ca/fr/local-commercial~a-louer~montreal-ville-marie/15988731?view=Summary
Commerciale et bureaux,1 895 $,https://mspublic.centris.ca/media.ashx?id=ADDD250DCA1A7F0DDDDDDDDDDE&t=pi&w=320&h=240&sm=c,"7105, Rue Saint-Hubert, local 102, Montréal (Rosemont/La Petite-Patrie), Quartier La Petite-Patrie","Le local est composé de 5 bureaux et une cuisinette. La superfice est environ de 1000 PC. la taxe municipale pour l'année 2022 à $4,100.00 par année",https://www.centris.ca/fr/batisse-commerciale~a-louer~montreal-rosemont-la-petite-patrie/15753076?view=Summary
Commerciale seulement,"44,50 $",https://mspublic.centris.ca/media.ashx?id=ADDD250DCCB33E2DDDDDDDDDD0&t=pi&w=320&h=240&sm=c,"4175, Rue Jean-Talon Ouest, local 101, Montréal (Côte-des-Neiges/Notre-Dame-de-Grâce), Quartier Côte-des-Neiges","Espace commercial RDC: 3,034 pi.ca. Peut être subdivisé. Idéal pour usage médical. Plan des lieux loués disponible sur demande.",https://www.centris.ca/fr/local-commercial~a-louer~montreal-cote-des-neiges-notre-dame-de-grace/11431484?view=Summary
Bureaux seulement,850 $,https://mspublic.centris.ca/media.ashx?id=ADDD250DCA6567EDDDDDDDDDD4&t=pi&w=320&h=240&sm=c,"12675, Rue Sherbrooke Est, local B001B, Montréal (Rivière-des-Prairies/Pointe-aux-Trembles), Quartier Pointe-aux-Trembles","Magnifique bureau situé au 2ième étage du centre d'achat le carrefour de la la pointe (Montréal PAT), endroit idéal pour un travailleur autonome, un professionnel ou une petite entreprise, un total de 3 bureaux sont présentement disponibles, accès aux espaces communs inclus, belle fenestration pour beaucoup de luminosité. Voici l'endroit qu'il vous faut! N'attendez plus!",https://www.centris.ca/fr/local-commercial~a-louer~montreal-riviere-des-prairies-pointe-aux-trembles/18963431?view=Summary
Commerciale seulement,3 100 $,https://mspublic.centris.ca/media.ashx?id=ADDD250DCE694AEDDDDDDDDDDE&t=pi&w=320&h=240&sm=c,"1957, Avenue du Mont-Royal Est, local A, Montréal (Le Plateau-Mont-Royal), Quartier Le Plateau-Mont-Royal",,https://www.centris.ca/fr/local-commercial~a-louer~montreal-le-plateau-mont-royal/9478274?view=Summary
Bureaux seulement,"14,50 $",https://mspublic.centris.ca/media.ashx?id=ADDD250D22FBC0CDDDDDDDDDD1&t=pi&w=320&h=240&sm=c,"4220, Rue de Rouen, local 201, Montréal (Mercier/Hochelaga-Maisonneuve), Quartier Hochelaga-Maisonneuve",,https://www.centris.ca/fr/batisse-commerciale~a-louer~montreal-mercier-hochelaga-maisonneuve/17657384?view=Summary
Commerciale et bureaux,1 395 $,https://mspublic.centris.ca/media.ashx?id=ADDD250DCC723AFDDDDDDDDDDB&t=pi&w=320&h=240&sm=c,"2197, Rue Sherbrooke Est, local 010, Montréal (Le Plateau-Mont-Royal), Quartier Le Plateau-Mont-Royal",Si vous êtes sur le site de Centris... Vous devez cliquer sur l'onglet fiche détaillée pour obtenir toute l'information. Si vous êtes sur le site de RE/MAX... simplement voir la section ADDENDA sous les photos pour accéder à toute l'information.,https://www.centris.ca/fr/local-commercial~a-louer~montreal-le-plateau-mont-royal/13732343?view=Summary
Bureaux seulement,13 $,https://mspublic.centris.ca/media.ashx?id=ADDD250DCCAD47ADDDDDDDDDDC&t=pi&w=320&h=240&sm=c,"9880, Rue Clark, local 350, Montréal (Ahuntsic-Cartierville), Quartier Ahuntsic Ouest","Bureaux professionnels aménagés à louer situés dans le secteur de Chabanel à seulement 650 mètres du métro Sauvé dans le quartier Ahuntsic. Le 9880 rue Clark est au coin de la rue Sauvé Ouest. Les espaces communs seront repensés sous peu. Plusieurs locaux disponibles entre 1500 à 4000 pieds carrés. Chaque unité bénéficie d'une grande fenestration. Autoroute, services et parcs à proximité. Nous restons à votre disposition pour plus d'informations.",https://www.centris.ca/fr/local-commercial~a-louer~montreal-ahuntsic-cartierville/16813757?view=Summary
Bureaux seulement,1 $,https://mspublic.centris.ca/media.ashx?id=ADDD250DCA36587DDDDDDDDDD4&t=pi&w=320&h=240&sm=c,"480, boulevard Saint-Laurent, Montréal (Ville-Marie), Quartier Centre","Loyer net - veuillez nous contacter. Loyer additonnel est 18,86 $ / pi. ca. Espace bureau situé en coin entièrement meublé offrant une lumière naturelle abondante. Immeuble de bureaux de style boutique bénéficiant d'infrastructures de qualité, entretenues selon les normes institutionnelles. Disposition principalement ouverte avec un minimum de bureaux fermés, comprenant plusieurs salles de conférence et salles de collaboration. Stratégiquement situé à quelques pas du palais de justice de Montréal et à proximité des transports en commun et des grands axes routiers.Disponible immédiatement. Mobilier et stationnement disponibles.",https://www.centris.ca/fr/batisse-commerciale~a-louer~montreal-ville-marie/9758973?view=Summary
Commerciale seulement,30 $,https://mspublic.centris.ca/media.ashx?id=ADDD250DC42F30EDDDDDDDDDD2&t=pi&w=320&h=240&sm=c,"1101, Rue Rachel Est, Montréal (Le Plateau-Mont-Royal), Quartier Le Plateau-Mont-Royal","Loyer additionnel : 10,72 $ / pc",https://www.centris.ca/fr/local-commercial~a-louer~montreal-le-plateau-mont-royal/9999980?view=Summary
Commerciale seulement,3 500 $,https://mspublic.centris.ca/media.ashx?id=ADDD250DCA104ECDDDDDDDDDD4&t=pi&w=320&h=240&sm=c,"1787, Rue du Centre, local 103, Montréal (Le Sud-Ouest), Quartier Pointe-Saint-Charles","Opportunité rare pour un tout nouvel espace de vente au détail avec des tonnes de visibilité. Situé sur la rue la plus vibrante au coeur de Pointe-Saint-Charles. Beaucoup d'opportunités pour un magasin de détail, un bureau de vente ou une clinique. Immeuble de base à terminer aux frais des locataires.",https://www.centris.ca/fr/local-commercial~a-louer~montreal-le-sud-ouest/19797218?view=Summary
Commerciale et bureaux,18 $,https://mspublic.centris.ca/media.ashx?id=ADDD250DCEF97CFDDDDDDDDDD1&t=pi&w=320&h=240&sm=c,"237, boulevard Crémazie Ouest, Montréal (Ahuntsic-Cartierville), Quartier Ahuntsic Ouest","Immeuble commercial à 3 étages Cette immeuble industriel multi-locataires est situé sur le boulevard Crémazie avec une grande visibilité de l'autoroute Métropolitaine compteurs d`hydro automne, Entièrement climatisé Près des transports en commun (autobus 52, 100 et 135) À 13 minutes du métro Crémazie, station de bus a 1 minutes. à 1 minute de l'autoroute 40 et autoroute 15.",https://www.centris.ca/fr/local-commercial~a-louer~montreal-ahuntsic-cartierville/13366483?view=Summary
Commerciale et bureaux,20 $,https://mspublic.centris.ca/media.ashx?id=ADDD250DC2F34C0DDDDDDDDDD4&t=pi&w=320&h=240&sm=c,"65, Rue Sherbrooke Est, Montréal (Le Plateau-Mont-Royal), Quartier Le Plateau-Mont-Royal","Situé au centre-ville de Montréal, disponible pour occupation immédiate et à proximité de nombreux restaurants, bars et hôtels, à la base d'une grande tour résidentielle.",https://www.centris.ca/fr/local-commercial~a-louer~montreal-le-plateau-mont-royal/16236318?view=Summary
Bureaux seulement,17 $,https://mspublic.centris.ca/media.ashx?id=ADDD250DC41C85DDDDDDDDDDD4&t=pi&w=320&h=240&sm=c,"2170, boulevard René-Lévesque Ouest, local 202, Montréal (Ville-Marie), Quartier Centre Ouest","ESPACES DE BUREAUX: 2E: 2,518 PI.CA. AUSSI UN 2269 PI.CA. AU RDC Immeuble de prestige stratégiquement situé dans le quartier ouest du centre-ville de Montréal, il est accessible du métro Atwater et offre un accès rapide à l'autoroute Ville-Marie. L'immeuble de quatre (4) étages, bénéficiant d'un éclairage naturel, est muni d'un ascenseur, d'un accès sécurisé et de plusieurs espaces de stationnement intérieurs et extérieurs. Superficie à Louer:de 1,500 à 7,101 pc Taux de location:17,00 $/pc Loyer additionnel: 15,84 $/pc",https://www.centris.ca/fr/local-commercial~a-louer~montreal-ville-marie/27586380?view=Summary
,175 $,https://mspublic.centris.ca/media.ashx?id=ADDD250DC01409ADDDDDDDDDDB&t=pi&w=320&h=240&sm=c,"5265, Rue MacKenzie, Montréal (Côte-des-Neiges/Notre-Dame-de-Grâce), Quartier Côte-des-Neiges",,https://www.centris.ca/fr/terrain~a-louer~montreal-cote-des-neiges-notre-dame-de-grace/24440881?view=Summary
Commerciale seulement,20 $,https://mspublic.centris.ca/media.ashx?id=ADDD250DCE133ADDDDDDDDDDDF&t=pi&w=320&h=240&sm=c,"440 - 444, Avenue Beaumont, local 2E ÉTAGE, Montréal (Villeray/Saint-Michel/Parc-Extension), Quartier Parc-Extension","Dans une secteur recherché de Parc Extension, Local de de 6,000 Pc è aménager, certains travaux seront assumées par le Locateur. Belle opportunité pour une entreprise qui désire aménager les lieux selon vos besoins. Idéal pour entreprise de services, Centre d'appels ou bureaux.",https://www.centris.ca/fr/local-commercial~a-louer~montreal-villeray-saint-michel-parc-extension/18829810?view=Summary
Commerciale et bureaux,16 $,https://mspublic.centris.ca/media.ashx?id=ADDD250D296D810DDDDDDDDDD1&t=pi&w=320&h=240&sm=c,"8000, boulevard Décarie, local 303, Montréal (Côte-des-Neiges/Notre-Dame-de-Grâce), Quartier Côte-des-Neiges","Le loyer débutera à 16,00$ pc + tps/tvq, 1ère année & sera sujet à des augmentations annuelles. Taxes foncières (est. 2021) 8,23$ / pi. ca. et Frais d'opérations (2021) 4,97$ / pi. ca. et électricité 2,80$/pi.ca.",https://www.centris.ca/fr/local-commercial~a-louer~montreal-cote-des-neiges-notre-dame-de-grace/9209367?view=Summary
Commerciale et bureaux,35 $,https://mspublic.centris.ca/media.ashx?id=ADDD250DCC75C02DDDDDDDDDDE&t=pi&w=320&h=240&sm=c,"56, Rue Notre-Dame Ouest, Montréal (Ville-Marie), Quartier Vieux-Montréal","Restaurant clé en main de 3,000 pieds carrés dans le vieux port, prêt pour que vous le fassiez vôtre. Près de la Place D'armes, de la Basilique Notre-Dame, de la rue St-Laurent et bien plus encore. Le sous-sol de 2,000 pieds carrés est également inclus. Le loyer supplémentaire fait partie du prix demandé.",https://www.centris.ca/fr/local-commercial~a-louer~montreal-ville-marie/23027649?view=Summary
Commerciale et bureaux,17 $,https://mspublic.centris.ca/media.ashx?id=ADDD250D2F4185FDDDDDDDDDDE&t=pi&w=320&h=240&sm=c,"2809, Rue Allard, Montréal (Le Sud-Ouest), Quartier Saint-Paul/Émard","Tres rare! Coin de rue offrant une excellente visibilité et un accès facile aux autoroutes 15, 20 et 720. Arrêt de bus directement en face du bâtiment et à seulement 5 minutes à pied de la station de métro Monk.",https://www.centris.ca/fr/local-commercial~a-louer~montreal-le-sud-ouest/11203483?view=Summary
Commerciale et bureaux,1 200 $,https://mspublic.centris.ca/media.ashx?id=ADDD250DCA7E1D9DDDDDDDDDDA&t=pi&w=320&h=240&sm=c,"163 - 167, Rue Fleury Ouest, Montréal (Ahuntsic-Cartierville), Quartier Ahuntsic Ouest",,https://www.centris.ca/fr/batisse-commerciale~a-louer~montreal-ahuntsic-cartierville/18537908?view=Summary
Commerciale et bureaux,23 $,https://mspublic.centris.ca/media.ashx?id=ADDD250DCAAB0BBDDDDDDDDDDD&t=pi&w=320&h=240&sm=c,"3965 - 3985, Rue Beaubien Est, Montréal (Rosemont/La Petite-Patrie), Quartier Rosemont Nord",Occasion à ne pas manquer. Unités commerciales à seulement quelques minutes du Collège Rosemont et de l'École secondaire Rosemont.,https://www.centris.ca/fr/local-commercial~a-louer~montreal-rosemont-la-petite-patrie/17029072?view=Summary
Commerciale et bureaux,24 $,https://mspublic.centris.ca/media.ashx?id=ADDD250DCEF931ADDDDDDDDDDA&t=pi&w=320&h=240&sm=c,"235, boulevard Crémazie Ouest, local 200, Montréal (Ahuntsic-Cartierville), Quartier Ahuntsic Ouest","Immeuble commercial à 3 étages Cette immeuble industriel multi-locataires est situé sur le boulevard Crémazie avec une grande visibilité de l'autoroute Métropolitaine compteurs d`hydro automne, Entièrement climatisé Près des transports en commun (autobus 52, 100 et 135) À 13 minutes du métro Crémazie, station de bus a 1 minutes. à 1 minute de l'autoroute 40 et autoroute 15.",https://www.centris.ca/fr/local-commercial~a-louer~montreal-ahuntsic-cartierville/21577902?view=Summary
Commerciale et bureaux,1 450 $,https://mspublic.centris.ca/media.ashx?id=ADDD250DCA626A7DDDDDDDDDDE&t=pi&w=320&h=240&sm=c,"1953, Rue Saint-Zotique Est, Montréal (Rosemont/La Petite-Patrie), Quartier La Petite-Patrie","on Local commercial situé sur la rue St-Zotique sur un très beau coin de rue dégagé, tout près de l'Avenue Papineau, à proximité du Métro Bel espace d'un peu plus de 1 100 pc pour un atelier, un bureau, Sous-sol complet avec salle de bain. Donnant accès à une zone résidentielle, à quelques pas d'un métro. 20% de plus pour les frais de l'immeuble (environ290.00$/mois .",https://www.centris.ca/fr/local-commercial~a-louer~montreal-rosemont-la-petite-patrie/25942071?view=Summary
Commerciale et bureaux,15 $,https://mspublic.centris.ca/media.ashx?id=ADDD250DCA82412DDDDDDDDDDF&t=pi&w=320&h=240&sm=c,"1084C, boulevard Saint-Laurent, Montréal (Ville-Marie), Quartier Centre","Immeuble commercial Historique & Romanesque au centre du Quartier Chinois (Ville-Marie), s'étendant du Boul. St-Laurent jusqu'à la rue Clark. Offrant plus de 6 000 pieds carrés à louer sur 3ème étage entièrement ouvert et prêt pour aménagement personnalisée. Idéal pour les firmes d'avocats, cliniques médicales, arts et spectacles, institutionnels et plus. Équipé d'un système de gicleurs, entrée de gaz, monte-charge (non fonctionnel). Loyer additionnel de 7 $/pi2/année pour les taxes et les dépenses d'exploitation. Près de 3 stations de Métro, Vieux-Port, Cartier des Spectacles, CHUM, UQAM & plus. Occupation immédiate!",https://www.centris.ca/fr/local-commercial~a-louer~montreal-ville-marie/15982446?view=Summary
Commerciale seulement,"26,23 $",https://mspublic.centris.ca/media.ashx?id=ADDD250DCA552DBDDDDDDDDDDA&t=pi&w=320&h=240&sm=c,"9720 - 9724, boulevard Gouin Ouest, Montréal (Pierrefonds-Roxboro), Quartier Pierrefonds/Est",,https://www.centris.ca/fr/batisse-commerciale~a-louer~montreal-pierrefonds-roxboro/9944631?view=Summary
Bureaux seulement,13 $,https://mspublic.centris.ca/media.ashx?id=ADDD250DCCAD2BDDDDDDDDDDDB&t=pi&w=320&h=240&sm=c,"9880, Rue Clark, local 360, Montréal (Ahuntsic-Cartierville), Quartier Ahuntsic Ouest","Bureaux professionnels aménagés à louer situés dans le secteur de Chabanel à seulement 650 mètres du métro Sauvé dans le quartier Ahuntsic. Le 9880 rue Clark est au coin de la rue Sauvé Ouest. Les espaces communs seront repensés sous peu. Plusieurs locaux disponibles entre 1500 à 4000 pieds carrés. Chaque unité bénéficie d'une grande fenestration. Autoroute, services et parcs à proximité. Nous restons à votre disposition pour plus d'informations.",https://www.centris.ca/fr/local-commercial~a-louer~montreal-ahuntsic-cartierville/18912841?view=Summary
Bureaux seulement,28 $,https://mspublic.centris.ca/media.ashx?id=ADDD250DCC4B9EDDDDDDDDDDDC&t=pi&w=320&h=240&sm=c,"4999, boulevard Saint-Charles, local 202, Montréal (L'Île-Bizard/Sainte-Geneviève), Quartier Sainte-Geneviève","Bureaux renovés, immeuble trés bien entretenu. Environnement calme et agréable. Idéal pour les professionnels et autres. Situé au coin du Boul St-Charles et Boul Gouin O.",https://www.centris.ca/fr/local-commercial~a-louer~montreal-l-ile-bizard-sainte-genevieve/19821029?view=Summary
Bureaux seulement,24 $,https://mspublic.centris.ca/media.ashx?id=ADDD250DCD34287DDDDDDDDDDB&t=pi&w=320&h=240&sm=c,"226, Rue Beaubien Est, local 2, Montréal (Rosemont/La Petite-Patrie), Quartier Petite Italie","Espace de bureau lumineux au 2e étage au coeur de La Petite Patrie.L'espace peut être subdivisé en aussi peu que 30% de l'espace jusqu' à 70% de l'espace. Entouré de restaurants, il se trouve à 2 rues de la Petite Italie, à 4 rues du métro Beaubien et à quelques pas du marché Jean-Talon. Cette grande unité de coin à aire ouverte possède 2 murs de fenêtres face à Beaubien et Alma. Ce logement dispose d'un accès à 3 nouvelles salles de bains communes. Une garderie est idéalement située au rez-de-chaussée de l'immeuble. Il y a possibilité de combiner ce local avec centris #28726650 & #28463900.",https://www.centris.ca/fr/local-commercial~a-louer~montreal-rosemont-la-petite-patrie/10779958?view=Summary
Commerciale et bureaux,1 002 $,https://mspublic.centris.ca/media.ashx?id=ADDD250DCEDFE60DDDDDDDDDDE&t=pi&w=320&h=240&sm=c,"4810, Rue Jean-Talon Ouest, local 404, Montréal (Côte-des-Neiges/Notre-Dame-de-Grâce), Quartier Côte-des-Neiges",,https://www.centris.ca/fr/local-commercial~a-louer~montreal-cote-des-neiges-notre-dame-de-grace/24150608?view=Summary
Commerciale et bureaux,13 $,https://mspublic.centris.ca/media.ashx?id=ADDD250DC226087DDDDDDDDDDB&t=pi&w=320&h=240&sm=c,"4505, boulevard Métropolitain Est, Montréal (Saint-Léonard)","Immeuble à bureaux au coeur de Montréal Est ayant accès direct à l'Autoroute 40 (Métropolitaine). Secteur achalandé avec grande visibilité! Les espaces, dernièrement rénovés, sont offerts avec tous les services, électricité, chauffage et air climatisé. L'immeuble offre aussi un très grand stationnement pour la clientèle et le personnels.",https://www.centris.ca/fr/local-commercial~a-louer~montreal-saint-leonard/13287833?view=Summary
Bureaux seulement,2 520 $,https://mspublic.centris.ca/media.ashx?id=ADDD250DCE2C637DDDDDDDDDDD&t=pi&w=320&h=240&sm=c,"1405, boulevard Henri-Bourassa Ouest, local 205, Montréal (Ahuntsic-Cartierville), Quartier Nouveau Bordeaux","Bureau rénové de 1728 pieds carrés dans un immeuble à bureau situé sur le boul. Henri-Bourassa à Ahuntsic, Montréal. Situé à 1 minutes de l'autoroute 15. Plusieurs bureaux fermé, salle de conférence, salle à diner et beaucoup de fenestration. Prix: 2520$/mois Tout inclus! (Frais d'opération, taxes scolaire et municipales, electricité, air climatisé et chauffage sont tous inclus!)",https://www.centris.ca/fr/local-commercial~a-louer~montreal-ahuntsic-cartierville/27044809?view=Summary
Commerciale seulement,3 500 $,https://mspublic.centris.ca/media.ashx?id=ADDD250DCC9B570DDDDDDDDDDC&t=pi&w=320&h=240&sm=c,"9050, boulevard Maurice-Duplessis, local 205, Montréal (Rivière-des-Prairies/Pointe-aux-Trembles), Quartier Rivière-des-Prairies","Immense 7 1/2 Local De 2,700 P/C. Situé Au 2e Étage Avec 4 Grandes Chambres Fermées Avec Cuisine Complète, Salle À Manger Et Salon À Aire Ouverte. Panneaux En Bois Massif Détaillés Sur Mur Du Salon. Salle De Bain Attenante Avec Douche Séparée Et Salle D'eau. Situé Sur Le Blvd Maurice-Duplessis Avec Grande Visibilité. Les Autres Locataires Sont De Longue Date (Garderie, Pharmacie Et Bureau De Comptables).",https://www.centris.ca/fr/local-commercial~a-louer~montreal-riviere-des-prairies-pointe-aux-trembles/23858759?view=Summary
Industrielle et bureaux,"18,71 $",https://mspublic.centris.ca/media.ashx?id=ADDD250DC0D04D9DDDDDDDDDD1&t=pi&w=320&h=240&sm=c,"5000, Rue D'Iberville, local 315, Montréal (Le Plateau-Mont-Royal), Quartier Le Plateau-Mont-Royal",Espace style loft bureau d'une superficie de 1090 pi². Belle luminosité. Localisation centrale sur île de Montréal sur D'Iberville à proximité de l'Avenue Mont-Royal. Accessibilité facile.,https://www.centris.ca/fr/local-industriel~a-louer~montreal-le-plateau-mont-royal/28272713?view=Summary
Commerciale et bureaux,32 $,https://mspublic.centris.ca/media.ashx?id=ADDD250DCABB286DDDDDDDDDD1&t=pi&w=320&h=240&sm=c,"232, Rue Beaubien Est, Montréal (Rosemont/La Petite-Patrie), Quartier Petite Italie","EMPLACEMENT INCROYABLE! Espace de vente au détail au niveau de la rue situé sur Beaubien au coin d'Alma au coeur de La Petite Patrie. Entouré d'autres détaillants, magasins, boutiques, bars et restaurants, il se trouve à 2 coins de rue de la Petite Italie, à 4 coins du métro Beaubien et à quelques pas du marché Jean-Talon. Arrêt d'autobus au coin de la rue. Cet espace commercial est doté d'une grande fenestration donnant sur Beaubien et Alma. Cuisine et salle de bain (6 toilettes). Une garderie occupe actuellement cet espace qui peut être transformé et subdivisé. Aucune visite lun-ven, 11h00-14h00.",https://www.centris.ca/fr/local-commercial~a-louer~montreal-rosemont-la-petite-patrie/17385696?view=Summary
Commerciale seulement,585 $,https://mspublic.centris.ca/media.ashx?id=ADDD250D25EA951DDDDDDDDDDB&t=pi&w=320&h=240&sm=c,"1040, Rue Notre-Dame, local A, Montréal (Lachine), Quartier Est","Ce splendide local à louer dans un emplacement de choix est celui qu'il vous faut! Cet espace est idéal pour y aménager votre salon de beauté (Esthétique, tattoo, massage...) Il offre une belle visibilité dans un salon de coiffure très achalandé de Lachine Est et à quelques pas du bord de l'eau. Chaise en location pour coiffeuse/coiffeur disponible.",https://www.centris.ca/fr/local-commercial~a-louer~montreal-lachine/22056939?view=Summary
Commerciale et bureaux,21 $,https://mspublic.centris.ca/media.ashx?id=ADDD250D26ED556DDDDDDDDDD0&t=pi&w=320&h=240&sm=c,"6848 - 6890, boulevard Newman, Montréal (LaSalle)","Loyer net est de 21,00 $ par pi.ca. (+ tps/tvq) et le loyer additionnel est de 7,00 $ par pi. ca. (+ tps/tvq) , sujet a des ajustements annuels.",https://www.centris.ca/fr/local-commercial~a-louer~montreal-lasalle/18644571?view=Summary
Bureaux seulement,"17,50 $",https://mspublic.centris.ca/media.ashx?id=ADDD250DCA3A838DDDDDDDDDD2&t=pi&w=320&h=240&sm=c,"1405, boulevard Henri-Bourassa Ouest, local 200, Montréal (Ahuntsic-Cartierville), Quartier Nouveau Bordeaux","Bureau rénové de 2440 pieds carrés dans un immeuble à bureau situé sur le boul. Henri-Bourassa à Ahuntsic, Montréal. Situé à 1 minutes de l'autoroute 15. Plusieurs bureaux fermés, cuisine, salle de conférence et un grand espace ouvert et beaucoup de fenestration. Prix: 3558$/mois Tout inclus! (Frais d'opération, taxes scolaire et municipales, électricité, air climatisé et chauffage sont tous inclus!)",https://www.centris.ca/fr/local-commercial~a-louer~montreal-ahuntsic-cartierville/23547901?view=Summary
Commerciale seulement,"16,50 $",https://mspublic.centris.ca/media.ashx?id=ADDD250DCAB7FBFDDDDDDDDDDA&t=pi&w=320&h=240&sm=c,"1751, Rue Richardson, local R110, Montréal (Le Sud-Ouest), Quartier Pointe-Saint-Charles","Les taxes et le loyer additionnel de 16,32 $ ppc sera ajouté au prix Espace restaurant clé en main disponible à Pointe-St-Charles CVC, électricité et éclairage entièrement distribués Accès aux quais de chargement Parking disponible Accès direct à la rue dans un immeuble de bureaux de plus de 800000 pc avec 240 unités résidentielles",https://www.centris.ca/fr/local-commercial~a-louer~montreal-le-sud-ouest/23815200?view=Summary
Commerciale et bureaux,25 $,https://mspublic.centris.ca/media.ashx?id=ADDD250D2660D9ADDDDDDDDDD1&t=pi&w=320&h=240&sm=c,"5998 - 6080, Chemin de la Côte-des-Neiges, Montréal (Côte-des-Neiges/Notre-Dame-de-Grâce), Quartier Côte-des-Neiges","Espaces bureaux multiples près de l'intersection des rues Côte-des-Neiges et Van Horne. Bâtiment rénové. Ententes de location flexibles avec possibilité d'aménagements sur mesure. Loyer brut incluant les taxes foncières, frais d'exploitation, assurance de l'immeuble, électricité et entretien ménagé des lieux loués.",https://www.centris.ca/fr/local-commercial~a-louer~montreal-cote-des-neiges-notre-dame-de-grace/17428842?view=Summary
Bureaux seulement,2 500 $,https://mspublic.centris.ca/media.ashx?id=ADDD250D2998587DDDDDDDDDDA&t=pi&w=320&h=240&sm=c,"1875, boulevard René-Lévesque Ouest, local B, Montréal (Ville-Marie), Quartier Centre Ouest",En processus de renovation. Bureau de 1500-1700pc au semi sous-sol avec un patio prive dans un immeuble semi-commercial. Emplacement exceptionnel au centre ville juste en face de la sortie Guy de l'autoroute 720E (Ville Marie) a 5 min de démarche du metro Guy.Possibilité d'espaces rénovés clef en main adaptés aux besoins pour un bail a long terme.(Negotiable),https://www.centris.ca/fr/local-commercial~a-louer~montreal-ville-marie/17125569?view=Summary
Commerciale et bureaux,"14,06 $",https://mspublic.centris.ca/media.ashx?id=ADDD250D299AEA3DDDDDDDDDDF&t=pi&w=320&h=240&sm=c,"507, Place d'Armes, local 401, Montréal (Ville-Marie), Quartier Vieux-Montréal","Le loyer débutera à 14,06$ pc + tps/tvq, 1ère année & sera sujet à des augmentations annuelles. TEL QUEL. Opex & taxes foncières (est. 2021) 15,94$/pi.ca. Allocation locative à négocier",https://www.centris.ca/fr/local-commercial~a-louer~montreal-ville-marie/23593500?view=Summary
